TITULO-DO-LIVRO,NUMERO-DE-VOLUMES,PAGINA-INICIAL,PAGINA-FINAL,ISBN,ORGANIZADORES,NUMERO-DA-EDICAO-REVISAO,NUMERO-DA-SERIE,CIDADE-DA-EDITORA,NOME-DA-EDITORA,CAPITULO-DE-LIVRO-PUBLICADO_Id
"Information Processing and Management of Uncertainty in Knowledge-Based System","2","324","333","3642140572","Eyke Hüllermeier; Rudolf Kruse; Frank Hoffmann","1","","","Springer",0
"CHALLENGES TO ECONOMIC ORGANIZATION: Plural Forms","","180","","9788522493722","Claude Ménard; Maria Sylvia Macchione Saes; Vivian Lara dos Santos Silva; Emmanuel Raynaud","1","","São Paulo","Atlas",1
"O mundo rural no Brasil do século 21 : a formação de um novo padrão agrário e agrícola","","175","","9788570353368","Antônio Márcio Buainain; Eliseu Alves; José Maria da Silveira; Zander Navarro,","1","","Brasília","Embrapa",2
"O mundo rural no Brasil do século 21 A formação de um novo padrão agrário e agrícola","1","295","","9788570353368","Antônio Márcio Buainain; Eliseu Alves; José Maria da Silveira; Zander Navarro,","1","","Brasília","Embrapa",3
"Políticas Estaduais para Arranjos Produtivos Locais no Sul, Sudeste e Centro-Oeste do Brasil","1","139","182","9788576502","Renato Ramos Campos; Fabio Sallivieiri; Marco Antônio Vargas; Marcelo Matos.","1","","Rio de Janeiro","E-papers",4
