TIPO,TITULO,ANO,PAIS,IDIOMA,NOME_DO_ORIENTADO
Dissertação de mestrado,Segmentação e Parcelamento do Corpo Caloso em Imagens de Tensor de Difusão,2012,Brasil,Português,Pedro Ferro Freitas
Dissertação de mestrado,Análise de Lesões na Substância Branca do Cérebro a partir de Imagens de Ressonância Magnética,2013,Brasil,Português,Mariana Pinheiro Bento Leite
Dissertação de mestrado,Ambiente para visualização e análise de Espectroscopia por Ressonância Magnética,2017,Brasil,Português,Danilo Rodrigues Pereira
Dissertação de mestrado,Segmentação dos pulmões e de suas lesões em imagens de tomografia computadorizada,2017,Brasil,Português,Silvia Regina Leme Colella
Dissertação de mestrado,Metodologia de construção e avaliação de padrão-prata em imagens de Ressonância Magnética para comparação de métodos de segmentação 2D do corpo caloso,2017,Brasil,Português,William Javier Garcia Herrera
Dissertação de mestrado,Desenvolvimento de métodos computacionais baseados em mecânica dos fluidos para análise e modelamento de dados DTI,2017,Brasil,Português,Gustavo Retuci Pinheiro
Dissertação de mestrado,Descritores de textura derivados de imagens de tensores de difusão,2017,Brasil,Português,Giovana Dos Santos Cover
Dissertação de mestrado,Maximal Max-tree simplification,2014,Brasil,Inglês,Roberto Medeiros de Souza
