TIPO-DE-ORIENTACAO,NOME-DO-ORIENTADO,CODIGO-INSTITUICAO,NOME-DA-INSTITUICAO,CODIGO-ORGAO,NOME-ORGAO,CODIGO-CURSO,NOME-DO-CURSO,FLAG-BOLSA,CODIGO-AGENCIA-FINANCIADORA,NOME-DA-AGENCIA,NUMERO-DE-PAGINAS,NUMERO-ID-ORIENTADO,NOME-DO-CURSO-INGLES,ORIENTACOES-CONCLUIDAS-PARA-POS-DOUTORADO_Id
"","Cláudio Alessandro de Carvalho Silva","007900000004","Universidade Estadual de Campinas","","","","","SIM","037700000002","Fundação de Amparo à Pesquisa do Estado de São Paulo","","","",0
"","Alberto Costa Nogueira Junior","007900000004","Universidade Estadual de Campinas","","","","","SIM","000800000994","Empresa Brasileira de Aeronáutica S/A","","","",1
"","Cedric Marcelo Augusto Ayala Bravo","007900000004","Universidade Estadual de Campinas","","","","","SIM","037700000002","Fundação de Amparo à Pesquisa do Estado de São Paulo","","","",2
"","Denise Siqueira Campos","007900000004","Universidade Estadual de Campinas","","","","","SIM","001100000990","Agencia Nacional do Petroleo","","","",3
"","Jorge Luiz Dias Calle","007900000004","Universidade Estadual de Campinas","","","","","SIM","001100000990","Agencia Nacional do Petroleo","","","",4
"","Douglas A Castro","007900000004","Universidade Estadual de Campinas","","","","","SIM","037700000002","Fundação de Amparo à Pesquisa do Estado de São Paulo","","","",5
"","João Luis Gonçalves","007900000004","Universidade Estadual de Campinas","","","","","NAO","","","","","",6
