TIPO-DE-ORIENTACAO,NOME-DO-ORIENTADO,CODIGO-INSTITUICAO,NOME-DA-INSTITUICAO,CODIGO-ORGAO,NOME-ORGAO,CODIGO-CURSO,NOME-DO-CURSO,FLAG-BOLSA,CODIGO-AGENCIA-FINANCIADORA,NOME-DA-AGENCIA,NUMERO-DE-PAGINAS,NUMERO-ID-ORIENTADO,NOME-DO-CURSO-INGLES,ORIENTACOES-CONCLUIDAS-PARA-POS-DOUTORADO_Id
"","Leonardo Cunha de Miranda","007900000004","Universidade Estadual de Campinas","","","","","SIM","037700000002","Fundação de Amparo à Pesquisa do Estado de São Paulo","","","",0
"","Leonelo Dell Anhol Almeida","007900000004","Universidade Estadual de Campinas","","","","","SIM","037700000002","Fundação de Amparo à Pesquisa do Estado de São Paulo","","","",1
"","Ig Ibert Bittencourt Santana Pinto","007900000004","Universidade Estadual de Campinas","","","","","SIM","002200000000","Conselho Nacional de Desenvolvimento Científico e Tecnológico","","","",2
"","Heiko Hornung","007900000004","Universidade Estadual de Campinas","","","","","NAO","","","","","",3
"","Alessandro Arpetti","007900000004","Universidade Estadual de Campinas","","","","","SIM","045000000000","Coordenação de Aperfeiçoamento de Pessoal de Nível Superior","","","",4
"","Julio Cesar dos Reis","007900000004","Universidade Estadual de Campinas","","","","","SIM","037700000002","Fundação de Amparo à Pesquisa do Estado de São Paulo","","","",5
"","Roberto Pereira","007900000004","Universidade Estadual de Campinas","","","","","SIM","037700000002","Fundação de Amparo à Pesquisa do Estado de São Paulo","","","",6
