NOME,ENTIDADE_PROMOTORA,ANO_DA_PREMIACAO
Primeiro Lugar no Curso de Bacharelado em Ciência da Computação,Instituto de Computação - Unicamp,1997
Mérito Científico e Tecnológico,Governo do Estado de São Paulo,2000
Primeiro Lugar no Concurso de Teses e Dissertações (CDT'2003),Sociedade Brasileira de Computação,2003
Prêmio de Excelência Didática,Instituto de Computação - Unicamp,2006
Professor Homenageado,Formandos do Bacharelado em Ciência da Computação da Unicamp,2007
Professor Homenageado,Formandos do Bacharelado em Ciência da Computação da Unicamp,2010
Prêmio de Reconhecimento Docente pela Dedicação ao Ensino de Graduação,Unicamp,2016
