NATUREZA,TITULO,ANO,PAIS,IDIOMA,MEIO-DE-DIVULGACAO,HOME-PAGE-DO-TRABALHO,FLAG-RELEVANCIA,TIPO-PARTICIPACAO,FORMA-PARTICIPACAO,DOI,TITULO-INGLES,FLAG-DIVULGACAO-CIENTIFICA,PARTICIPACAO-EM-SIMPOSIO_Id
"Simpósio","?Financiarización de la habitación en el capitalismo dependiente? evidencias de Brasil?","2017","Brasil","","NAO_INFORMADO","","NAO","Conferencista","Convidado","","","NAO",0
"Simpósio","O todo sem a parte não é todo, a parte sem o todo não é parte. Em busca de um novo patamar de compreensão da reestruturação metropolitana","2011","Brasil","","NAO_INFORMADO","","NAO","Simposista","Convidado","","","NAO",1
"Simpósio","A cidade e a ditadura","2014","Brasil","","NAO_INFORMADO","","NAO","Conferencista","Convidado","","","NAO",2
"Simpósio","Global City São Paulo: Financial Foundations of a Mirage","2006","Estados Unidos","","NAO_INFORMADO","","NAO","Apresentação Oral","Participante","","","NAO",3
"Simpósio","Desafios urbanos às metrópoles latino-americanas","2008","Brasil","","NAO_INFORMADO","","NAO","Simposista","Convidado","","","NAO",4
"Simpósio","7º Prêmio Jovens Arquitetos","2005","Brasil","","NAO_INFORMADO","","NAO","Conferencista","Convidado","","","NAO",5
"Simpósio","Informal Urbanisaton: origins, drivers and impacts","2016","Holanda","","NAO_INFORMADO","","NAO","Conferencista","Convidado","","Informal Urbanisaton: origins, drivers and impacts","NAO",6
"Simpósio","Land Value Capture and the Right to the City in Unequal Cities","2016","México","","NAO_INFORMADO","","NAO","Conferencista","Convidado","","Land Value Capture and the Right to the City in Unequal Cities","NAO",7
"Simpósio","Parceiros da exclusão","2010","Brasil","","NAO_INFORMADO","","NAO","Conferencista","Convidado","","","NAO",8
