NATUREZA,TIPO,TITULO,ANO,PAIS,IDIOMA,HOME-PAGE,FLAG-RELEVANCIA,DOI,TITULO-INGLES,ORIENTACOES-CONCLUIDAS-PARA-MESTRADO_Id
"Dissertação de mestrado","ACADEMICO","Segmentação e Parcelamento do Corpo Caloso em Imagens de Tensor de Difusão","2012","Brasil","Português","","NAO","","",0
"Dissertação de mestrado","ACADEMICO","Análise de Lesões na Substância Branca do Cérebro a partir de Imagens de Ressonância Magnética","2013","Brasil","Português","","NAO","","",1
"Dissertação de mestrado","ACADEMICO","Ambiente para visualização e análise de Espectroscopia por Ressonância Magnética","2017","Brasil","Português","","NAO","","",2
"Dissertação de mestrado","ACADEMICO","Segmentação dos pulmões e de suas lesões em imagens de tomografia computadorizada","2017","Brasil","Português","","NAO","","",3
"Dissertação de mestrado","ACADEMICO","Metodologia de construção e avaliação de padrão-prata em imagens de Ressonância Magnética para comparação de métodos de segmentação 2D do corpo caloso","2017","Brasil","Português","","NAO","","",4
"Dissertação de mestrado","ACADEMICO","Desenvolvimento de métodos computacionais baseados em mecânica dos fluidos para análise e modelamento de dados DTI","2017","Brasil","Português","","NAO","","",5
"Dissertação de mestrado","ACADEMICO","Descritores de textura derivados de imagens de tensores de difusão","2017","Brasil","Português","","NAO","","",6
"Dissertação de mestrado","ACADEMICO","Maximal Max-tree simplification","2014","Brasil","Inglês","","NAO","","",7
