NOME-DO-CANDIDATO,CODIGO-INSTITUICAO,NOME-INSTITUICAO,CODIGO-ORGAO,NOME-ORGAO,CODIGO-CURSO,NOME-CURSO,NOME-CURSO-INGLES,PARTICIPACAO-EM-BANCA-DE-DOUTORADO_Id
"Mônica Mitiko Soares Matsumoto","006700000002","Universidade de São Paulo","","","90000019","Doutorado em Cardiologia","",0
"Fábio Augusto Faria","007900000004","Universidade Estadual de Campinas","","","33070059","Ciência da Computação","Computer Science",1
"Elizângela dos Santos","007900000004","Universidade Estadual de Campinas","","","90000020","Programa de Pós-Graduação em Clínica Médica","",2
"Sergio San Juan Dertkigil","007900000004","Universidade Estadual de Campinas","","","33070237","Ciências Médicas","Clinical Medicine",3
"Marco Aurélio Granero Santos","007900000004","Universidade Estadual de Campinas","","","60034394","Doutorado em Engenharia Elétrica","Engineering",4
"Mariana Pinheiro Bento Leite","007900000004","Universidade Estadual de Campinas","","","60046295","Doutorado em Engenharia Elétrica - UNICAMP","Engineering",5
