NOME-DO-CANDIDATO,CODIGO-INSTITUICAO,NOME-INSTITUICAO,CODIGO-ORGAO,NOME-ORGAO,CODIGO-CURSO,NOME-CURSO,NOME-CURSO-INGLES,PARTICIPACAO-EM-BANCA-DE-MESTRADO_Id
"Tiago Willian Pinto","007900000004","Universidade Estadual de Campinas","","","60056916","TECNOLOGIA","",0
"Mariana Pinheiro Bento","007900000004","Universidade Estadual de Campinas","","","90000010","Mestrado em Engenharia Elétrica","",1
"Pietro Martins de Oliveira","032900000005","Universidade Estadual de Maringá","","","60015594","Ciência da Computação","Computer Science",2
"Veronica M Gaiarsa","006700000002","Universidade de São Paulo","","","33020450","Engenharia Elétrica","Electric Engineering",3
"Mauricio Lisboa Perez","007900000004","Universidade Estadual de Campinas","","","33070059","Ciência da Computação","Computer Science",4
"Danilo Rodrigues Pereira","007900000004","Universidade Estadual de Campinas","","","90000010","Mestrado em Engenharia Elétrica","",5
"Giovana Dos Santos Cover","007900000004","Universidade Estadual de Campinas","","","90000010","Mestrado em Engenharia Elétrica","",6
"Maria Carolina Ferreira de Souza","007900000004","Universidade Estadual de Campinas","","","33070237","Ciências Médicas","Clinical Medicine",7
