PROJETO-DE-PESQUISA_Id,SEQUENCIA-PROJETO,ANO-INICIO,ANO-FIM,NOME-DO-PROJETO,SITUACAO,NATUREZA,NUMERO-GRADUACAO,NUMERO-ESPECIALIZACAO,NUMERO-MESTRADO-ACADEMICO,NUMERO-MESTRADO-PROF,NUMERO-DOUTORADO,DESCRICAO-DO-PROJETO,IDENTIFICADOR-PROJETO,DESCRICAO-DO-PROJETO-INGLES,NOME-DO-PROJETO-INGLES,FLAG-POTENCIAL-INOVACAO,NOME-COORDENADOR-CERTIFICACAO,DATA-CERTIFICACAO,NUMERO_TECNICO_NIVEL_MEDIO,PARTICIPACAO-EM-PROJETO_Id
0,"1","2005","2010","Segmentação de objetos via Transformada Watershed","CONCLUIDO","PESQUISA","","","","","","A Transformada Watershed é uma das técnicas mais poderosas de segmentação de objetos em imagens digitais. Este projeto visa o estudo da transformada Watershed, a comparação entre as diversas definições existentes, a implementação eficiente e o desenvolvimento de diversas aplicações.","","","Segmentação de objetos via Transformada Watershed","NAO","","","",0
1,"3","2010","2012","Plataforma colaborativa para processamento de imagens médicas baseada no ambiente Adessowiki;","CONCLUIDO","PESQUISA","1","","1","","1","Os desafios na pesquisa em imagens médicas são enormes: a multimodalidade e complexidade das imagens, o caráter multidisciplinar das equipes, as distâncias geográficas entre os centros de pesquisa envolvidos, entre outros. Para promover a pesquisa e a publicação científica na área é preciso garantir a integração entre os profissionais envolvidos e a utilização de ferramentas adequadas, e atualizadas. É também desejável que o registro da pesquisa seja garantido e os dados, configurações e parâmetros necessários à reprodução do experimento fiquem disponíveis.

Com o objetivo de atender a todos estes requisitos, o que propomos é uma plataforma de processamento de imagens médicas baseada no ambiente Adessowiki, um ambiente Web colaborativo de redação de texto e programação científica que permite a inserção de códigos de programa em suas páginas. A plataforma terá uma base de dados de imagens médicas e um conjunto de funções que permitirá o desenvolvimento de pesquisas na área. A integração entre diferentes pesquisas irá ampliar e complementar a plataforma.

O projeto aqui proposto tem como objetivo a aplicação do Adessowiki na área de imagens médicas, através de um sandbox de execução especializado, e a adaptação de sua arquitetura para permitir sua utilização em cenários de alta demanda, possibilitando, assim, o aumento rápido da base de sua usuários.","","","1.6. Plataforma colaborativa para processamento de imagens médicas baseada no ambiente Adessowiki;","NAO","","","",1
2,"4","2013","","Programas de Inovação Tecnológica / CEPID - Centros de Pesquisa, Inovação e Difusão - Edital 2011 CEPID: Instituto Brasileiro de Neurociência e Neurotecnologia (Brazilian Institute of Neuroscience and Neurotechnology) - BRAINN FAPESP processo 201307559-3","EM_ANDAMENTO","PESQUISA","","","","","","Programas de Inovação Tecnológica / CEPID - Centros de Pesquisa, Inovação e Difusão - Edital 2011.","","","","NAO","","","",2
3,"6","2010","2014","Segmentação de imagens de tensores de difusão no contexto da morfologia matemática","CONCLUIDO","PESQUISA","","","","","","","","","Segmentação de imagens de tensores de difusão no contexto da morfologia matemática","NAO","","","",3
4,"7","2014","","Métodos computacionais para análise de estruturas e tecidos cerebrais através de imagens multimodais","EM_ANDAMENTO","PESQUISA","4","","","","3","O projeto é composto por dois tópicos principais: 1) detecção e classificação de anormalidades em tecidos cerebrais a partir de imagens de ressonância magnética e, 2) a caracterização do corpo caloso (CC) através de imagens de difusão por ressonância magnética (diffusion MRI), para identificação de anormalidades nesta estrutura cerebral. 
Este projeto tem o objetivo de desenvolver atividades conjuntas de pesquisa em análise de neuroimagens com o Prof. Richard Frayne, diretor científico do Seaman Family Centre, cientista do Hotchkiss Brain Institute (HBI) e professor dos Departamentos de Radiologia e de Neurociência Clínica, Engenharia Elétrica e de Computação e Física e Astronomia, todos órgão da Universidade de Calgary, Canadá.","","","","NAO","","","",4
5,"8","2016","2016","Da Eletrônica à Computação: Não é Mágica é Ciência!","CONCLUIDO","EXTENSAO","4","","4","","2","Oferecimento de oficinas de programação e eletrônica oferecidas a alunos do ensino fundamental e médio de escolas públicas da região de Campinas.","","","Da Eletrônica à Computação: Não é Mágica é Ciência!","NAO","","","",5
6,"9","2016","2017","Confecção de kits didáticos e construção de plataforma de fabricação","CONCLUIDO","OUTRA","","","","","","","","","","NAO","","","",6
7,"2","2005","","Processamento de Imagens Médicas","EM_ANDAMENTO","PESQUISA","","","","","","Desenvolvimento de técnicas de processamento de imagens aplicadas à Medicina, tanto em imagens tridimensionais de tomografia e ressonância magnética, como de imagens bidimensionais de células.","","","","NAO","","","",7
8,"5","2012","2013","Métodos de segmentação e classificação baseados em grafos para imagens de tensores de difusão do cérebro","CONCLUIDO","PESQUISA","","","","","","","","","Métodos de segmentação e classificação baseados em grafos para imagens de tensores de difusão do cérebro","NAO","","","",8
